{
  "status": "COMPLETED",
  "summary": "합성 근거 snapshot에 한정된 검증 결과입니다.",
  "citations": [],
  "unknowns": ["설치·인증 비용 포함 여부"],
  "abstention_reasons": [],
  "recommended_actions": [
    {
      "action_type": "VERIFY_DOCUMENT",
      "reason": "비교 가능성을 바꿀 수 있는 포함 비용을 확인한다.",
      "target": "detailed-cost-breakdown"
    }
  ],
  "claim_results": [
    {
      "claim_index": 0,
      "status": "VERIFIED",
      "unsupported_fragments": [],
      "verified_evidence_ids": ["00000000-0000-0000-0000-0000000003e9"]
    }
  ]
}
